{
  "id": "550e8400-e29b-41d4-a716-446655440000",
  "timestamp": "2024-01-15T10:30:00Z",
  "source_post_id": "x_post_12345",
  "seed_params": {
    "topic": "AI development",
    "style": "technical",
    "length": 280,
    "thread_size": 1
  },
  "score": 0.85,
  "metrics": {
    "impressions": 1000,
    "engagement_rate": 5.5,
    "retweets": 15,
    "likes": 55
  },
  "strategy_features": ["hashtag_usage", "question_pattern", "call_to_action"],
  "provider": "mlx::llama-3.2-3b",
  "metadata": {
    "extraction_method": "reer_v1.0",
    "confidence": 0.92
  }
}